{
  "schema_version": "timing_infrastructure_four_layer_inventory@1.0",
  "status": "step_a_frozen_waiting_lane_execution",
  "updated_at": "2026-09-01",
  "production_authority": false,
  "execution_order": [
    "clock",
    "measurement",
    "strategy_foundation",
    "strategy_ephemeral",
    "execution"
  ],
  "owner_lanes": {
    "1": "clock",
    "2": "measurement_and_strategy",
    "3": "execution"
  },
  "shared_frozen": [
    "docs/ops/timing_infrastructure_four_layer_inventory@1.0.json",
    "docs/schemas/json/timing_infrastructure_four_layer_inventory@1.0.json",
    "ai-readme.md",
    "README.md",
    "docs/00-index.md",
    "docs/user/README.md",
    "docs/ops/README.md",
    "docs/ops/project_asset_layer_inventory@1.0.json",
    "src/factor_lab/filtering/",
    "src/factor_lab/market_state/attribute_pool_infrastructure.py"
  ],
  "allowlist_intersection_exceptions": [
    {
      "path": "docs/ops/market_state_attribute_pool_overlay_mo_theta@1.0.json",
      "allowed_lanes": [
        3
      ],
      "reason": "named derivatives overlay; the only permitted cross-layer attribute-pool exception class"
    },
    {
      "path": "docs/ops/market_state_attribute_pool_overlay_csi1000_execution_v1@1.0.json",
      "allowed_lanes": [
        3
      ],
      "reason": "named derivatives overlay"
    }
  ],
  "split_required": [
    {
      "from": "six_axis_unified_catalog",
      "into": [
        "six_axis_common_market_state",
        "tool_relative_coupling"
      ]
    },
    {
      "from": "paper_kernel",
      "into": [
        "paper_kernel_timeseries",
        "paper_kernel_tool_identity"
      ]
    },
    {
      "from": "volatility_regime_recognizer_nested_v2",
      "into": [
        "volatility_continuous_features",
        "volatility_three_state_machine"
      ]
    },
    {
      "from": "formula_derived_v3",
      "into": [
        "formula_derived_tool_inversion",
        "formula_derived_joint_state_machine"
      ]
    },
    {
      "from": "attribute_pool_v1",
      "into": [
        "attribute_pool_kline_four_pools",
        "attribute_pool_derivatives_overlay"
      ]
    }
  ],
  "assets": [
    {
      "asset_id": "unified_offset_data_and_backtest",
      "layer": "clock",
      "owner_lane": 1,
      "reusable": true,
      "live_entry": "docs/ops/unified_offset_data_and_backtest_whitepaper.md",
      "code": [
        "src/factor_lab/data/session_offset_defaults.py"
      ],
      "tests": [],
      "workflow": "docs/user/unified_offset_data_and_backtest_workflow.md",
      "whitepaper": "docs/ops/unified_offset_data_and_backtest_whitepaper.md",
      "write_allowlist": [
        "src/factor_lab/data/session_offset_defaults.py",
        "docs/ops/unified_offset_data_and_backtest_whitepaper.md",
        "docs/user/unified_offset_data_and_backtest_workflow.md"
      ],
      "measurement_authority": false,
      "routing_authority": false,
      "split_from": null,
      "current": true,
      "production_authority": false,
      "write_denylist": [
        "docs/ops/timing_infrastructure_four_layer_inventory@1.0.json",
        "docs/schemas/json/timing_infrastructure_four_layer_inventory@1.0.json",
        "ai-readme.md",
        "README.md",
        "docs/00-index.md",
        "docs/user/README.md",
        "docs/ops/README.md",
        "docs/ops/project_asset_layer_inventory@1.0.json",
        "src/factor_lab/filtering/",
        "src/factor_lab/market_state/attribute_pool_infrastructure.py"
      ]
    },
    {
      "asset_id": "datahub_on_demand_kline_binding",
      "layer": "clock",
      "owner_lane": 1,
      "reusable": true,
      "live_entry": "docs/user/csi1000_datahub_on_demand_kline_binding_workflow.md",
      "code": [
        "src/factor_lab/market_state/csi1000_datahub_gap_closure.py"
      ],
      "tests": [
        "tests/unit/test_csi1000_datahub_gap_closure.py"
      ],
      "workflow": "docs/user/csi1000_datahub_on_demand_kline_binding_workflow.md",
      "whitepaper": "docs/ops/csi1000_datahub_on_demand_kline_binding_whitepaper.md",
      "write_allowlist": [
        "docs/user/csi1000_datahub_on_demand_kline_binding_workflow.md",
        "docs/ops/csi1000_datahub_on_demand_kline_binding@1.0.json"
      ],
      "measurement_authority": false,
      "routing_authority": false,
      "note": "lane1 may only change clock-binding docs/identity; not LAT/option matching in gap_closure.py",
      "split_from": null,
      "current": true,
      "production_authority": false,
      "write_denylist": [
        "docs/ops/timing_infrastructure_four_layer_inventory@1.0.json",
        "docs/schemas/json/timing_infrastructure_four_layer_inventory@1.0.json",
        "ai-readme.md",
        "README.md",
        "docs/00-index.md",
        "docs/user/README.md",
        "docs/ops/README.md",
        "docs/ops/project_asset_layer_inventory@1.0.json",
        "src/factor_lab/filtering/",
        "src/factor_lab/market_state/attribute_pool_infrastructure.py"
      ]
    },
    {
      "asset_id": "csi1000_5m_research_runtime",
      "layer": "clock",
      "owner_lane": 1,
      "reusable": true,
      "live_entry": "docs/user/csi1000_5m_research_runtime_workflow.md",
      "code": [
        "src/factor_lab/market_state/csi1000_5m_research_runtime.py"
      ],
      "tests": [],
      "workflow": "docs/user/csi1000_5m_research_runtime_workflow.md",
      "whitepaper": "docs/ops/csi1000_5m_research_runtime_whitepaper.md",
      "write_allowlist": [
        "src/factor_lab/market_state/csi1000_5m_research_runtime.py",
        "docs/user/csi1000_5m_research_runtime_workflow.md"
      ],
      "measurement_authority": false,
      "routing_authority": false,
      "split_from": null,
      "current": true,
      "production_authority": false,
      "write_denylist": [
        "docs/ops/timing_infrastructure_four_layer_inventory@1.0.json",
        "docs/schemas/json/timing_infrastructure_four_layer_inventory@1.0.json",
        "ai-readme.md",
        "README.md",
        "docs/00-index.md",
        "docs/user/README.md",
        "docs/ops/README.md",
        "docs/ops/project_asset_layer_inventory@1.0.json",
        "src/factor_lab/filtering/",
        "src/factor_lab/market_state/attribute_pool_infrastructure.py"
      ]
    },
    {
      "asset_id": "shifted_bar_derivation",
      "layer": "clock",
      "owner_lane": 1,
      "reusable": true,
      "live_entry": "docs/ops/shifted_bar_derivation_whitepaper.md",
      "code": [],
      "tests": [],
      "workflow": "docs/api/headless_cli_reference.md",
      "whitepaper": "docs/ops/shifted_bar_derivation_whitepaper.md",
      "write_allowlist": [
        "docs/ops/shifted_bar_derivation_whitepaper.md"
      ],
      "measurement_authority": false,
      "routing_authority": false,
      "split_from": null,
      "current": true,
      "production_authority": false,
      "write_denylist": [
        "docs/ops/timing_infrastructure_four_layer_inventory@1.0.json",
        "docs/schemas/json/timing_infrastructure_four_layer_inventory@1.0.json",
        "ai-readme.md",
        "README.md",
        "docs/00-index.md",
        "docs/user/README.md",
        "docs/ops/README.md",
        "docs/ops/project_asset_layer_inventory@1.0.json",
        "src/factor_lab/filtering/",
        "src/factor_lab/market_state/attribute_pool_infrastructure.py"
      ]
    },
    {
      "asset_id": "daily_afternoon_remake",
      "layer": "clock",
      "owner_lane": 1,
      "reusable": true,
      "live_entry": "docs/user/market_state_daily_afternoon_remake_workflow.md",
      "code": [
        "src/factor_lab/market_state/timing_artifact_identity.py"
      ],
      "tests": [],
      "workflow": "docs/user/market_state_daily_afternoon_remake_workflow.md",
      "whitepaper": "docs/ops/unified_offset_data_and_backtest_whitepaper.md",
      "write_allowlist": [
        "src/factor_lab/market_state/timing_artifact_identity.py",
        "docs/user/market_state_daily_afternoon_remake_workflow.md",
        "src/factor_lab/market_state/timing_intraday_infrastructure_remake.py"
      ],
      "measurement_authority": false,
      "routing_authority": false,
      "split_from": null,
      "current": true,
      "production_authority": false,
      "write_denylist": [
        "docs/ops/timing_infrastructure_four_layer_inventory@1.0.json",
        "docs/schemas/json/timing_infrastructure_four_layer_inventory@1.0.json",
        "ai-readme.md",
        "README.md",
        "docs/00-index.md",
        "docs/user/README.md",
        "docs/ops/README.md",
        "docs/ops/project_asset_layer_inventory@1.0.json",
        "src/factor_lab/filtering/",
        "src/factor_lab/market_state/attribute_pool_infrastructure.py"
      ]
    },
    {
      "asset_id": "session_clock_reference",
      "layer": "clock",
      "owner_lane": 1,
      "reusable": true,
      "live_entry": "docs/user/market_state_session_clock_reference_workflow.md",
      "code": [
        "src/factor_lab/market_state/session_clock_reference.py"
      ],
      "tests": [],
      "workflow": "docs/user/market_state_session_clock_reference_workflow.md",
      "whitepaper": "docs/ops/market_state_session_clock_reference_whitepaper.md",
      "write_allowlist": [
        "src/factor_lab/market_state/session_clock_reference.py",
        "docs/user/market_state_session_clock_reference_workflow.md",
        "docs/ops/market_state_session_clock_reference_whitepaper.md"
      ],
      "measurement_authority": false,
      "routing_authority": false,
      "split_from": null,
      "current": true,
      "production_authority": false,
      "write_denylist": [
        "docs/ops/timing_infrastructure_four_layer_inventory@1.0.json",
        "docs/schemas/json/timing_infrastructure_four_layer_inventory@1.0.json",
        "ai-readme.md",
        "README.md",
        "docs/00-index.md",
        "docs/user/README.md",
        "docs/ops/README.md",